{
  "deterministic_package_digest": "703dd4b56f4b34289a2c5bc5521ad4ddc3113bdec8c38238c3244c69cb4d58df",
  "kind": "rtl_comparison_vector_package",
  "manifest": {
    "file_count": 10,
    "files": [
      {
        "name": "frp_m15_cell_trace.vec",
        "sha256": "b3192cbfbe89b31517212a09fd4d14f58180e2d1594a45412856399c4be5781d",
        "size_bytes": 112549
      },
      {
        "name": "frp_m15_full_correlation_vectors.vec",
        "sha256": "c2e2a92d7031b85d2681fdaba839bbc4a0d833be14c8516d15dcaed347940d73",
        "size_bytes": 16689
      },
      {
        "name": "frp_m15_kernel_vectors.vec",
        "sha256": "87e063cdbe49d32ecfda129e0a5c6a8c77d022fdfa07eeed891a1b4f271d29bf",
        "size_bytes": 8815
      },
      {
        "name": "frp_m15_pending_routes.trace",
        "sha256": "600125de9484bb3b2275a98a64eba06d751a8ce129e29c3eb49b14142e01afc5",
        "size_bytes": 818
      },
      {
        "name": "frp_m15_reference_preload.json",
        "sha256": "88cf005a76a659c0f51a16a1499b6fa6251b09eb26434538eb27ca5718b1a4a0",
        "size_bytes": 1387
      },
      {
        "name": "frp_m15_scheduler_1_7_vectors.vec",
        "sha256": "5cf1912cbc492004656f41fff4ff36e5146e281b4f79a0e90606747b7c0bc649",
        "size_bytes": 5028
      },
      {
        "name": "frp_m15_scheduler_7_1_vectors.vec",
        "sha256": "9e777e7eb9fa4adeca52bc83ebedd5275aad2ebbc32f34140102131cd4aa4c7e",
        "size_bytes": 5017
      },
      {
        "name": "frp_m15_scheduler_free_vectors.vec",
        "sha256": "836b9e2fb5079f93f9666e534823735c6f22f48c8def4b6301ec3119ac52a518",
        "size_bytes": 5023
      },
      {
        "name": "frp_m15_sha256_manifest.json",
        "sha256": "8dafbe3dea995d94c84a8ea02b9393bd53b9b986b8cc852af55f2ea67dc1d839",
        "size_bytes": 935
      },
      {
        "name": "frp_m15_trig_lut_q30.vec",
        "sha256": "caadbbf97fe0bacf2d82eaa5da4cd1fb6cf1e1514809d3e743311e19893d11bb",
        "size_bytes": 72471
      }
    ]
  },
  "milestone": "M15 — Implementation Mapping, Domain Interface, and Qualification Closure Package",
  "schema": "frp.m15.rtl_comparison_vector_package.v1.7.0",
  "vector_classes": [
    "kernel_transition_vectors",
    "scheduler_vectors",
    "full_correlation_vectors"
  ],
  "version": "1.7.0"
}
